{
  "$schema": "../../schemas/class-index.schema.json",
  "schema_version": 1,
  "key": "drv",
  "menu_number": 2,
  "name": "DRV",
  "class_id": 3,
  "effect_files": [
    "001_skreamer.json",
    "002_skreamer9.json",
    "003_butter_od.json",
    "004_warm_od.json",
    "005_super_od.json",
    "006_blues_od.json",
    "007_full_od.json",
    "008_breaker_od.json",
    "009_gerden_od.json",
    "010_timmy_od.json",
    "011_master_od.json",
    "012_solar_fuzz.json",
    "013_fuzz_cream.json",
    "014_red_fuzz.json",
    "015_jp_dist.json",
    "016_dark_mouse.json",
    "017_plexi_dist.json",
    "018_master_dist.json",
    "019_dist_plus.json",
    "020_shark.json",
    "021_strive.json",
    "022_sardar_dist.json",
    "023_bass_od.json",
    "024_bass_dist.json"
  ]
}
