{
  "$schema": "../../schemas/class-index.schema.json",
  "schema_version": 1,
  "key": "cab",
  "menu_number": 6,
  "name": "CAB",
  "class_id": 5,
  "effect_files": [
    "001_supero_1x6.json",
    "002_chap_1x8.json",
    "003_prince_1x10.json",
    "004_twd_2x10.json",
    "005_twd_lux_1x12.json",
    "006_dark_lux_1x12.json",
    "007_twin_verb_2x12.json",
    "008_custom_2x12.json",
    "009_b_man_2x10.json",
    "010_b_man_4x10.json",
    "011_jazz_2x12.json",
    "012_brit_1x12.json",
    "013_brit_gn_2x12.json",
    "014_brit_ld_4x12.json",
    "015_brit_td_4x12.json",
    "016_brit_md_4x12.json",
    "017_brit_gn_4x12.json",
    "018_brit_75_4x12.json",
    "019_brit_bk_4x12.json",
    "020_voks_1x12.json",
    "021_voks_2x12.json",
    "022_bog_sv_1x12.json",
    "023_chief_2x12.json",
    "024_calif_dual_4x12.json",
    "025_calif_star_1x12.json",
    "026_calif_star_2x12.json",
    "027_calif_1x12.json",
    "028_supero_2x12.json",
    "029_superb_2x12.json",
    "030_blue_2x12.json",
    "031_halen_4x12.json",
    "032_bog_4x12.json",
    "033_eng_4x12.json",
    "034_bog_ub_4x12.json",
    "035_sol_4x12.json",
    "036_tanger_4x12.json",
    "037_watt_4x12.json",
    "038_wam_4x12.json",
    "039_humble_4x12.json",
    "040_dizzy_4x12.json",
    "041_calif_4x12.json",
    "042_dv_1x15.json",
    "043_dv_4x10.json",
    "044_work_1x15.json",
    "045_work_4x10.json",
    "046_calif_2x10.json",
    "047_mak_2x10.json",
    "048_a_bass_1x15.json",
    "049_a_bass_4x10.json",
    "050_a_bass_8x10.json",
    "051_hart_4x12.json",
    "052_d_1.json",
    "053_d_2.json",
    "054_om.json",
    "055_jumbo.json",
    "056_bird.json",
    "057_ga.json",
    "058_classical_ac.json",
    "059_mandolin.json",
    "060_fretless_bass.json",
    "061_double_bass.json"
  ]
}
